{
  "schemaVersion": "1.0.0",
  "productionId": "production.benchmark.selector.forward-unseen",
  "storyModelHash": "6119ed1e020a5f7be801bf8bdf263935caed9c8a395b63b433fc0b1812f21c8e",
  "libraryLockRef": "lock.forward-unseen.enabled",
  "provenancePolicy": {
    "enabledPackIds": [
      "pack.zelda-mainline"
    ],
    "blockedPackIds": [],
    "allowCorePromotedFromBlockedPack": false
  },
  "query": {
    "storySignals": [
      "signal.hidden-causal-rule",
      "signal.revisited-place",
      "signal.relationship-memory",
      "signal.transformable-environment",
      "signal.landmark-mystery",
      "signal.embodied-secret"
    ],
    "experienceGoals": [
      "experience.self-directed-discovery",
      "experience.social-recognition",
      "experience.world-recontextualization"
    ],
    "spatialConstraints": [
      "signal.revisited-place",
      "signal.transformable-environment",
      "signal.landmark-mystery"
    ],
    "runtimeCapabilities": [
      "capability.world-facts",
      "capability.map-layers",
      "capability.route-gates",
      "capability.inventory",
      "capability.context-interaction",
      "capability.npc-state",
      "capability.dialogue-gates",
      "capability.performance-cues",
      "capability.camera-cues",
      "capability.portal-transitions",
      "capability.grid-collision",
      "capability.spatial-query",
      "capability.checkpoints",
      "capability.hint-ladder",
      "capability.route-simulation",
      "capability.telemetry"
    ],
    "budget": {
      "design": "medium",
      "code": "medium",
      "art": "medium",
      "qa": "high"
    },
    "negativeSignals": []
  },
  "consideredCandidates": [
    {
      "patternId": "pattern.embodied-world-change-reveal",
      "patternVersion": "1.1.0",
      "scores": {
        "storyRelevance": 5,
        "dramaticIntegration": 3.75,
        "systemicDepth": 3.2,
        "stateCausality": 4,
        "spatialReinterpretation": 5,
        "runtimeFit": 5,
        "budgetFit": 3,
        "originalityMargin": 5,
        "weightedTotal": 4.28
      },
      "hardVetoes": [],
      "verdict": "selected",
      "reasons": [
        "Matched 3 causal story signals and passed runtime/originality prefilters."
      ]
    },
    {
      "patternId": "pattern.dense-overworld-as-challenge-space",
      "patternVersion": "1.1.0",
      "scores": {
        "storyRelevance": 5,
        "dramaticIntegration": 2.75,
        "systemicDepth": 3.8,
        "stateCausality": 5,
        "spatialReinterpretation": 5,
        "runtimeFit": 5,
        "budgetFit": 3,
        "originalityMargin": 5,
        "weightedTotal": 4.27
      },
      "hardVetoes": [],
      "verdict": "deferred",
      "reasons": [
        "Matched 3 causal story signals and passed runtime/originality prefilters."
      ]
    },
    {
      "patternId": "pattern.npc-reacts-to-world-state",
      "patternVersion": "1.1.0",
      "scores": {
        "storyRelevance": 5,
        "dramaticIntegration": 3.75,
        "systemicDepth": 3.2,
        "stateCausality": 4,
        "spatialReinterpretation": 4,
        "runtimeFit": 3,
        "budgetFit": 3,
        "originalityMargin": 5,
        "weightedTotal": 3.98
      },
      "hardVetoes": [
        "runtime-impossible"
      ],
      "verdict": "rejected",
      "reasons": [
        "Runtime gaps: capability.schedule-clock"
      ]
    },
    {
      "patternId": "pattern.state-axis-rewrites-routes",
      "patternVersion": "1.1.0",
      "scores": {
        "storyRelevance": 3.333,
        "dramaticIntegration": 2.75,
        "systemicDepth": 3.8,
        "stateCausality": 5,
        "spatialReinterpretation": 5,
        "runtimeFit": 5,
        "budgetFit": 3,
        "originalityMargin": 5,
        "weightedTotal": 3.853
      },
      "hardVetoes": [],
      "verdict": "deferred",
      "reasons": [
        "Matched 2 causal story signals and passed runtime/originality prefilters."
      ]
    },
    {
      "patternId": "pattern.reward-expands-future-possibility",
      "patternVersion": "2.0.0",
      "scores": {
        "storyRelevance": 3.333,
        "dramaticIntegration": 4,
        "systemicDepth": 3.2,
        "stateCausality": 4,
        "spatialReinterpretation": 5,
        "runtimeFit": 3,
        "budgetFit": 3,
        "originalityMargin": 5,
        "weightedTotal": 3.713
      },
      "hardVetoes": [
        "runtime-impossible",
        "manual-binding-incomplete"
      ],
      "verdict": "rejected",
      "reasons": [
        "Reward 2.0 manual binding closure is incomplete: exactly one explicit acquisition transaction is required; the acquisition transaction must declare an atomic commit; one or more explicit persistent state refs are required; at least two explicit reward functions are required; reward functions must span at least two distinct functional dimensions; an explicit economy rule ref is required; a passed, evidenced protected-story-order check is required."
      ]
    },
    {
      "patternId": "pattern.capability-recontextualizes-old-space",
      "patternVersion": "1.1.0",
      "scores": {
        "storyRelevance": 3.333,
        "dramaticIntegration": 2.75,
        "systemicDepth": 3.2,
        "stateCausality": 4,
        "spatialReinterpretation": 5,
        "runtimeFit": 5,
        "budgetFit": 3,
        "originalityMargin": 5,
        "weightedTotal": 3.663
      },
      "hardVetoes": [],
      "verdict": "deferred",
      "reasons": [
        "Matched 2 causal story signals and passed runtime/originality prefilters."
      ]
    },
    {
      "patternId": "pattern.landmark-promises-future-use",
      "patternVersion": "1.1.0",
      "scores": {
        "storyRelevance": 3.333,
        "dramaticIntegration": 2.75,
        "systemicDepth": 3.2,
        "stateCausality": 4,
        "spatialReinterpretation": 4,
        "runtimeFit": 5,
        "budgetFit": 3,
        "originalityMargin": 5,
        "weightedTotal": 3.563
      },
      "hardVetoes": [],
      "verdict": "deferred",
      "reasons": [
        "Matched 2 causal story signals and passed runtime/originality prefilters."
      ]
    },
    {
      "patternId": "pattern.optional-secret-readability",
      "patternVersion": "1.1.0",
      "scores": {
        "storyRelevance": 3.333,
        "dramaticIntegration": 2.75,
        "systemicDepth": 3.8,
        "stateCausality": 5,
        "spatialReinterpretation": 2,
        "runtimeFit": 5,
        "budgetFit": 3,
        "originalityMargin": 5,
        "weightedTotal": 3.553
      },
      "hardVetoes": [],
      "verdict": "deferred",
      "reasons": [
        "Matched 2 causal story signals and passed runtime/originality prefilters."
      ]
    },
    {
      "patternId": "pattern.parallel-state-comparison",
      "patternVersion": "1.1.0",
      "scores": {
        "storyRelevance": 3.333,
        "dramaticIntegration": 2.5,
        "systemicDepth": 3.8,
        "stateCausality": 4,
        "spatialReinterpretation": 0,
        "runtimeFit": 3,
        "budgetFit": 3,
        "originalityMargin": 5,
        "weightedTotal": 3.003
      },
      "hardVetoes": [
        "runtime-impossible"
      ],
      "verdict": "rejected",
      "reasons": [
        "Runtime gaps: capability.save-migration"
      ]
    },
    {
      "patternId": "pattern.constrained-vehicle-route",
      "patternVersion": "1.1.0",
      "scores": {
        "storyRelevance": 1.667,
        "dramaticIntegration": 1.5,
        "systemicDepth": 4.8,
        "stateCausality": 4,
        "spatialReinterpretation": 2,
        "runtimeFit": 5,
        "budgetFit": 3,
        "originalityMargin": 5,
        "weightedTotal": 2.937
      },
      "hardVetoes": [],
      "verdict": "rejected",
      "reasons": [
        "Fewer than two causal story signals matched."
      ]
    },
    {
      "patternId": "pattern.action-first-onboarding",
      "patternVersion": "1.1.0",
      "scores": {
        "storyRelevance": 1.667,
        "dramaticIntegration": 2.5,
        "systemicDepth": 3.8,
        "stateCausality": 5,
        "spatialReinterpretation": 0,
        "runtimeFit": 5,
        "budgetFit": 3,
        "originalityMargin": 5,
        "weightedTotal": 2.887
      },
      "hardVetoes": [],
      "verdict": "rejected",
      "reasons": [
        "Fewer than two causal story signals matched."
      ]
    },
    {
      "patternId": "pattern.local-rule-development-arc",
      "patternVersion": "1.1.0",
      "scores": {
        "storyRelevance": 1.667,
        "dramaticIntegration": 1.5,
        "systemicDepth": 4.8,
        "stateCausality": 4,
        "spatialReinterpretation": 0,
        "runtimeFit": 5,
        "budgetFit": 3,
        "originalityMargin": 5,
        "weightedTotal": 2.737
      },
      "hardVetoes": [],
      "verdict": "rejected",
      "reasons": [
        "Fewer than two causal story signals matched."
      ]
    }
  ],
  "selectedApplications": [
    {
      "applicationId": "application.selector.forward-unseen.1",
      "patternId": "pattern.embodied-world-change-reveal",
      "patternVersion": "1.1.0",
      "role": "core",
      "originPackRefs": [
        "pack.zelda-mainline"
      ],
      "storyRefs": [
        "storyModel.facts",
        "storyModel.locations",
        "storyModel.revealOrder",
        "storyModel.protectedCanon"
      ],
      "retainedPrinciples": [
        "Treat a player-completed world-state transition as one atomic change: stage a coordinated before-and-after cue and make at least one affected navigation, actor, or interaction state observable in subsequent play."
      ],
      "adaptationSummary": "Instantiate Embodied world-change reveal from the fixture’s own actors, locations, facts, and props while preserving its reveal order and changing all source-facing expression.",
      "discardedSurfaceDetails": [
        "source light-dark or corruption-restoration cosmology",